"","Term","Overlap","P.value","Adjusted.P.value","Odds.Ratio","Combined.Score","Genes"
"684","icosanoid metabolic process (GO:0006690)","1/57",0.248824541413001,0.341089407863953,3.57936507936508,4.97892289699759,"EPHX1"
"685","monocarboxylic acid transport (GO:0015718)","1/57",0.248824541413001,0.341089407863953,3.57936507936508,4.97892289699759,"CD36"
"686","negative regulation of hydrolase activity (GO:0051346)","1/58",0.252591147960672,0.342427737576397,3.5163919900762,4.83849599837867,"CSTA"
"687","negative regulation of neuron projection development (GO:0010977)","1/58",0.252591147960672,0.342427737576397,3.5163919900762,4.83849599837867,"EPHA4"
"688","cellular iron ion homeostasis (GO:0006879)","1/58",0.252591147960672,0.342427737576397,3.5163919900762,4.83849599837867,"FTL"
"689","eye development (GO:0001654)","1/58",0.252591147960672,0.342427737576397,3.5163919900762,4.83849599837867,"SOX2"
"690","fat cell differentiation (GO:0045444)","1/58",0.252591147960672,0.342427737576397,3.5163919900762,4.83849599837867,"MAFB"
"691","regulation of tumor necrosis factor-mediated signaling pathway (GO:0010803)","1/58",0.252591147960672,0.342427737576397,3.5163919900762,4.83849599837867,"HSPA1A"
"692","membrane lipid biosynthetic process (GO:0046467)","1/58",0.252591147960672,0.342427737576397,3.5163919900762,4.83849599837867,"CERS3"
"693","positive regulation of nucleic acid-templated transcription (GO:1903508)","4/511",0.252718234441367,0.342427737576397,1.59377054569362,2.19219968349269,"SOX2;JUN;MAFB;FOS"
"694","regulation of programmed cell death (GO:0043067)","2/194",0.253111278929468,0.342466125237422,2.09481292517007,2.87811804627837,"SGK1;CLU"
"695","protein localization to membrane (GO:0072657)","2/195",0.254963277350062,0.34447556464994,2.08385323041134,2.84786833198991,"CD81;ATP1B3"
"696","negative regulation of autophagy (GO:0010507)","1/59",0.256339055642632,0.344845806946177,3.45559038662487,4.70393718537215,"DAPL1"
"697","positive regulation of apoptotic signaling pathway (GO:2001235)","1/59",0.256339055642632,0.344845806946177,3.45559038662487,4.70393718537215,"S100A8"
"698","fatty acid oxidation (GO:0019395)","1/59",0.256339055642632,0.344845806946177,3.45559038662487,4.70393718537215,"ADH7"
"699","apical junction assembly (GO:0043297)","1/60",0.260068356267662,0.348365458680934,3.39684985447697,4.57491398098809,"CLDN4"
"700","cellular response to chemokine (GO:1990869)","1/60",0.260068356267662,0.348365458680934,3.39684985447697,4.57491398098809,"ACKR3"
"701","response to organic cyclic compound (GO:0014070)","1/60",0.260068356267662,0.348365458680934,3.39684985447697,4.57491398098809,"AQP3"
"702","B cell differentiation (GO:0030183)","1/61",0.263779141308675,0.350833730437459,3.34006734006734,4.45111773409346,"SLC25A5"
"703","regulation of DNA-templated transcription, initiation (GO:2000142)","1/61",0.263779141308675,0.350833730437459,3.34006734006734,4.45111773409346,"JUN"
"704","response to light stimulus (GO:0009416)","1/61",0.263779141308675,0.350833730437459,3.34006734006734,4.45111773409346,"MAPK10"
"705","positive regulation of interleukin-8 production (GO:0032757)","1/61",0.263779141308675,0.350833730437459,3.34006734006734,4.45111773409346,"HSPA1A"
"706","iron ion homeostasis (GO:0055072)","1/61",0.263779141308675,0.350833730437459,3.34006734006734,4.45111773409346,"FTL"
"707","negative regulation of kinase activity (GO:0033673)","1/62",0.267471501800711,0.353740479142067,3.28514654744163,4.33226156152993,"HSPB1"
"708","positive regulation of cysteine-type endopeptidase activity (GO:2001056)","1/62",0.267471501800711,0.353740479142067,3.28514654744163,4.33226156152993,"CTSD"
"709","response to retinoic acid (GO:0032526)","1/62",0.267471501800711,0.353740479142067,3.28514654744163,4.33226156152993,"AQP3"
"710","stress-activated MAPK cascade (GO:0051403)","1/62",0.267471501800711,0.353740479142067,3.28514654744163,4.33226156152993,"MAPK10"
"711","axon guidance (GO:0007411)","2/203",0.269787257396922,0.356301314621252,2.00010153315057,2.62037615304045,"EPHB6;EPHA4"
"712","amyloid fibril formation (GO:1990000)","1/63",0.271145528260931,0.357090674666219,3.23199739328772,4.21807849737542,"CD36"
"713","negative regulation of endopeptidase activity (GO:0010951)","1/63",0.271145528260931,0.357090674666219,3.23199739328772,4.21807849737542,"TIMP3"
"714","protein catabolic process (GO:0030163)","1/64",0.274801310842782,0.361398362578953,3.18053551386885,4.10831982313615,"CTSD"
"715","regulation of inflammatory response (GO:0050727)","2/206",0.275346793926217,0.361609286009396,1.9703881552621,2.54125670985675,"CXCL17;S100A8"
"716","regulation of protein kinase B signaling (GO:0051896)","2/207",0.277199672471101,0.363130783224649,1.96067695370831,2.51558224197517,"AKR1C3;AKR1C2"
"717","regulation of cell-matrix adhesion (GO:0001952)","1/65",0.278438939213788,0.363130783224649,3.13068181818182,4.00275356439037,"CD36"
"718","regulation of cellular catabolic process (GO:0031329)","1/65",0.278438939213788,0.363130783224649,3.13068181818182,4.00275356439037,"HSPB1"
"719","inorganic anion transmembrane transport (GO:0098661)","1/65",0.278438939213788,0.363130783224649,3.13068181818182,4.00275356439037,"GABRE"
"720","steroid biosynthetic process (GO:0006694)","1/65",0.278438939213788,0.363130783224649,3.13068181818182,4.00275356439037,"AKR1C3"
"721","cellular component disassembly (GO:0022411)","1/66",0.282058502576368,0.365818969501671,3.08236208236208,3.90116313048372,"MMP12"
"722","cellular response to nutrient levels (GO:0031669)","1/66",0.282058502576368,0.365818969501671,3.08236208236208,3.90116313048372,"AKR1C3"
"723","regulation of protein localization (GO:0032880)","1/66",0.282058502576368,0.365818969501671,3.08236208236208,3.90116313048372,"CTSD"
"724","extracellular matrix disassembly (GO:0022617)","1/66",0.282058502576368,0.365818969501671,3.08236208236208,3.90116313048372,"MMP12"
"725","vascular endothelial growth factor receptor signaling pathway (GO:0048010)","1/67",0.285660089808726,0.369979068041922,3.03550658096113,3.80334608196671,"HSPB1"
"726","canonical Wnt signaling pathway (GO:0060070)","1/68",0.289243789255229,0.372054682343369,2.99004975124378,3.70911301693322,"FZD6"
"727","negative regulation of transforming growth factor beta receptor signaling pathway (GO:0030512)","1/68",0.289243789255229,0.372054682343369,2.99004975124378,3.70911301693322,"HSPA1A"
"728","regulation of myeloid cell differentiation (GO:0045637)","1/68",0.289243789255229,0.372054682343369,2.99004975124378,3.70911301693322,"MAFB"
"729","regulation of translational initiation (GO:0006446)","1/68",0.289243789255229,0.372054682343369,2.99004975124378,3.70911301693322,"HSPB1"
"730","interferon-gamma-mediated signaling pathway (GO:0060333)","1/68",0.289243789255229,0.372054682343369,2.99004975124378,3.70911301693322,"HLA-DRA"
"731","negative regulation of multicellular organismal process (GO:0051241)","2/214",0.290161134004554,0.372724083215153,1.89526376588371,2.34504563216826,"ARRDC3;ALDH1A1"
"732","positive regulation of intracellular signal transduction (GO:1902533)","4/546",0.291516339804197,0.373571056873572,1.48816113161132,1.83439554053851,"SOX2;AKR1C3;AKR1C2;S100A8"
"733","cell chemotaxis (GO:0060326)","1/69",0.29280968888067,0.373571056873572,2.94592988710636,3.61828655610275,"ACKR3"
"734","cellular response to calcium ion (GO:0071277)","1/69",0.29280968888067,0.373571056873572,2.94592988710636,3.61828655610275,"AKR1C3"
"735","cellular response to decreased oxygen levels (GO:0036294)","1/69",0.29280968888067,0.373571056873572,2.94592988710636,3.61828655610275,"AQP3"
"736","peptidyl-tyrosine phosphorylation (GO:0018108)","1/69",0.29280968888067,0.373571056873572,2.94592988710636,3.61828655610275,"EPHA4"
"737","extracellular structure organization (GO:0043062)","2/216",0.293860347736136,0.374328314526779,1.87736028991036,2.29911046589758,"MMP12;SPINK5"
"738","negative regulation of cell population proliferation (GO:0008285)","3/379",0.294562756428595,0.374328314526779,1.60594428602764,1.96288660809705,"SOX2;KRT4;HSPA1A"
"739","regulation of gene expression (GO:0010468)","7/1079",0.294599174052491,0.374328314526779,1.32197881559942,1.61564263258985,"SOX2;MAFB;PIP;CD36;CLU;LGALS7;HSPA1A"
"740","external encapsulating structure organization (GO:0045229)","2/217",0.295709072188337,0.375040492931415,1.86853345989559,2.27658225012256,"MMP12;SPINK5"
"741","neutrophil chemotaxis (GO:0030593)","1/70",0.296357876203525,0.375040492931415,2.9030888596106,3.53070042231205,"S100A8"
"742","positive regulation of cell-substrate adhesion (GO:0010811)","1/70",0.296357876203525,0.375040492931415,2.9030888596106,3.53070042231205,"CD36"
"743","regulation of endopeptidase activity (GO:0052548)","1/71",0.299888438313403,0.377980192719846,2.86147186147186,3.44619860155019,"TIMP3"
"744","gland development (GO:0048732)","1/71",0.299888438313403,0.377980192719846,2.86147186147186,3.44619860155019,"SOX2"
"745","response to metal ion (GO:0010038)","1/71",0.299888438313403,0.377980192719846,2.86147186147186,3.44619860155019,"AQP3"
"746","negative regulation of supramolecular fiber organization (GO:1902904)","1/72",0.303401461859655,0.380874295035048,2.82102717313985,3.36463457832852,"CLU"
"747","cytoskeleton-dependent cytokinesis (GO:0061640)","1/72",0.303401461859655,0.380874295035048,2.82102717313985,3.36463457832852,"RHOB"
"748","response to ionizing radiation (GO:0010212)","1/72",0.303401461859655,0.380874295035048,2.82102717313985,3.36463457832852,"RHOB"
"749","antigen processing and presentation of exogenous peptide antigen via MHC class I, TAP-dependent (GO:0002479)","1/73",0.306897033111884,0.382704268382548,2.78170594837262,3.28587063696556,"CD36"
"750","regulation of actin filament-based process (GO:0032970)","1/73",0.306897033111884,0.382704268382548,2.78170594837262,3.28587063696556,"RHOB"
"751","regulation of hydrolase activity (GO:0051336)","1/73",0.306897033111884,0.382704268382548,2.78170594837262,3.28587063696556,"EPHA4"
"752","granulocyte chemotaxis (GO:0071621)","1/73",0.306897033111884,0.382704268382548,2.78170594837262,3.28587063696556,"S100A8"
"753","response to molecule of bacterial origin (GO:0002237)","1/73",0.306897033111884,0.382704268382548,2.78170594837262,3.28587063696556,"S100A8"
"754","cellular response to amino acid starvation (GO:0034198)","1/74",0.310375237892897,0.386016355472093,2.74346201743462,3.20977722405069,"DAPL1"
"755","sphingolipid biosynthetic process (GO:0030148)","1/74",0.310375237892897,0.386016355472093,2.74346201743462,3.20977722405069,"CERS3"
"756","response to amino acid starvation (GO:1990928)","1/75",0.313836161648445,0.388547849505757,2.70625170625171,3.13623236372496,"DAPL1"
"757","positive regulation of lymphocyte proliferation (GO:0050671)","1/75",0.313836161648445,0.388547849505757,2.70625170625171,3.13623236372496,"CD81"
"758","positive regulation of T cell activation (GO:0050870)","1/75",0.313836161648445,0.388547849505757,2.70625170625171,3.13623236372496,"CD81"
"759","negative regulation of cellular process (GO:0048523)","4/566",0.314065833626059,0.388547849505757,1.43371886120996,1.66046530394245,"TXNIP;CLU;RHOB;HSPA1A"
"760","regulation of cell division (GO:0051302)","1/76",0.317279889350664,0.389445511242188,2.67003367003367,3.0651211233087,"TXNIP"
"761","chloride transport (GO:0006821)","1/76",0.317279889350664,0.389445511242188,2.67003367003367,3.0651211233087,"GABRE"
"762","establishment of protein localization to organelle (GO:0072594)","1/76",0.317279889350664,0.389445511242188,2.67003367003367,3.0651211233087,"MMP12"
"763","regulation of RNA splicing (GO:0043484)","1/76",0.317279889350664,0.389445511242188,2.67003367003367,3.0651211233087,"HSPA1A"
"764","positive regulation of growth (GO:0045927)","1/76",0.317279889350664,0.389445511242188,2.67003367003367,3.0651211233087,"S100A8"
"765","protein import into nucleus (GO:0006606)","1/76",0.317279889350664,0.389445511242188,2.67003367003367,3.0651211233087,"MMP12"
"766","inflammatory response (GO:0006954)","2/230",0.319670132319446,0.390588078754377,1.76083064804869,2.00816687197463,"FOS;S100A8"
"767","purine ribonucleotide metabolic process (GO:0009150)","1/77",0.320706505558706,0.390588078754377,2.6347687400319,2.99633512170869,"DBI"
"768","neutrophil migration (GO:1990266)","1/77",0.320706505558706,0.390588078754377,2.6347687400319,2.99633512170869,"S100A8"
"769","phosphatidylcholine metabolic process (GO:0046470)","1/77",0.320706505558706,0.390588078754377,2.6347687400319,2.99633512170869,"DBI"
"770","import into nucleus (GO:0051170)","1/77",0.320706505558706,0.390588078754377,2.6347687400319,2.99633512170869,"MMP12"
"771","inorganic cation import across plasma membrane (GO:0098659)","1/77",0.320706505558706,0.390588078754377,2.6347687400319,2.99633512170869,"ATP1B3"
"772","regulation of autophagy (GO:0010506)","2/231",0.321506425753241,0.391055095572919,1.75305231262811,1.98925463460844,"DAPL1;HSPB1"
"773","protein modification process (GO:0036211)","1/78",0.324116094429913,0.392703242154436,2.60041978223796,2.92977207832515,"PLAT"
"774","negative regulation of blood vessel morphogenesis (GO:2000181)","1/78",0.324116094429913,0.392703242154436,2.60041978223796,2.92977207832515,"SPINK5"
"775","antigen processing and presentation of exogenous peptide antigen via MHC class I (GO:0042590)","1/78",0.324116094429913,0.392703242154436,2.60041978223796,2.92977207832515,"CD36"
"776","regulation of cellular response to heat (GO:1900034)","1/79",0.32750873980153,0.395792415281385,2.56695156695157,2.86533539771871,"HSPA1A"
"777","regulation of neuron differentiation (GO:0045664)","1/79",0.32750873980153,0.395792415281385,2.56695156695157,2.86533539771871,"SOX2"
"778","transmembrane receptor protein tyrosine kinase signaling pathway (GO:0007169)","3/404",0.328781468844228,0.39681979337369,1.50389490192046,1.67287550682863,"EPHB6;EPHA4;PLAT"
"779","negative regulation of cell cycle (GO:0045786)","1/80",0.330884524972772,0.397315305561935,2.5343306482547,2.80293378962301,"RHOB"
"780","negative regulation of extrinsic apoptotic signaling pathway (GO:2001237)","1/80",0.330884524972772,0.397315305561935,2.5343306482547,2.80293378962301,"HSPA1A"
"781","regulation of organelle organization (GO:0033043)","1/80",0.330884524972772,0.397315305561935,2.5343306482547,2.80293378962301,"S100A8"
"782","positive regulation of cell adhesion (GO:0045785)","1/80",0.330884524972772,0.397315305561935,2.5343306482547,2.80293378962301,"EPHA4"
"783","activation of cysteine-type endopeptidase activity involved in apoptotic process (GO:0006919)","1/81",0.334243532854352,0.399814875605397,2.50252525252525,2.74248091594401,"S100A8"
"784","negative regulation of protein modification process (GO:0031400)","1/81",0.334243532854352,0.399814875605397,2.50252525252525,2.74248091594401,"DBI"
"785","regulation of interleukin-8 production (GO:0032677)","1/81",0.334243532854352,0.399814875605397,2.50252525252525,2.74248091594401,"HSPA1A"
"786","positive regulation of protein ubiquitination (GO:0031398)","1/82",0.337585846063778,0.403253263593503,2.47150517520888,2.68389506560141,"ARRDC3"
"787","axonogenesis (GO:0007409)","2/240",0.337976909955364,0.403253263593503,1.68598868118676,1.8289229230858,"EPHB6;EPHA4"
"788","peptide metabolic process (GO:0006518)","1/83",0.340911546721369,0.405723627847104,2.44124168514412,2.62709885646942,"GSTA4"
"789","long-chain fatty acid metabolic process (GO:0001676)","1/83",0.340911546721369,0.405723627847104,2.44124168514412,2.62709885646942,"EPHX1"
"790","lymphocyte differentiation (GO:0030098)","1/84",0.344220716526821,0.408626109758135,2.41170743580382,2.57201895784243,"SLC25A5"
"791","vascular transport (GO:0010232)","1/84",0.344220716526821,0.408626109758135,2.41170743580382,2.57201895784243,"SLC7A8"
"792","negative regulation of defense response (GO:0031348)","1/85",0.347513436866072,0.410459266939927,2.38287638287638,2.51858583349566,"CXCL17"
"793","B cell activation (GO:0042113)","1/85",0.347513436866072,0.410459266939927,2.38287638287638,2.51858583349566,"SLC25A5"
"794","regulation of cell cycle G2/M phase transition (GO:1902749)","1/85",0.347513436866072,0.410459266939927,2.38287638287638,2.51858583349566,"TUBA4A"
"795","Wnt signaling pathway, planar cell polarity pathway (GO:0060071)","1/85",0.347513436866072,0.410459266939927,2.38287638287638,2.51858583349566,"FZD6"
"796","organelle organization (GO:0006996)","3/420",0.350699720413942,0.412771443077187,1.44500482088556,1.51411205948455,"CENPW;KRT4;KRT13"
"797","negative regulation of cellular amide metabolic process (GO:0034249)","1/86",0.350789788685405,0.412771443077187,2.35472370766488,2.46673350535558,"CLU"
"798","regulation of interferon-gamma production (GO:0032649)","1/86",0.350789788685405,0.412771443077187,2.35472370766488,2.46673350535558,"LGALS7"
"799","negative regulation of angiogenesis (GO:0016525)","1/87",0.354049852499014,0.415047205364012,2.3272257458304,2.41639933353241,"SPINK5"
"800","regulation of transcription from RNA polymerase II promoter in response to stress (GO:0043618)","1/87",0.354049852499014,0.415047205364012,2.3272257458304,2.41639933353241,"HSPA1A"
"801","sodium ion transmembrane transport (GO:0035725)","1/87",0.354049852499014,0.415047205364012,2.3272257458304,2.41639933353241,"ATP1B3"
"802","negative regulation of binding (GO:0051100)","1/88",0.357293708483398,0.417806715150574,2.30035992104958,2.36752381170365,"JUN"
"803","regulation of establishment of planar polarity (GO:0090175)","1/88",0.357293708483398,0.417806715150574,2.30035992104958,2.36752381170365,"FZD6"
"804","regulation of endothelial cell migration (GO:0010594)","1/89",0.360521436424534,0.420533700375948,2.27410468319559,2.32005037808893,"RHOB"
"805","post-Golgi vesicle-mediated transport (GO:0006892)","1/89",0.360521436424534,0.420533700375948,2.27410468319559,2.32005037808893,"FTL"
"806","regulation of canonical Wnt signaling pathway (GO:0060828)","2/253",0.361554469638934,0.420693490695117,1.59760956175299,1.62531622060724,"SOX2;FZD6"
"807","positive regulation of phosphorylation (GO:0042327)","2/253",0.361554469638934,0.420693490695117,1.59760956175299,1.62531622060724,"EPHB6;EPHA4"
"808","negative regulation of protein kinase activity (GO:0006469)","1/90",0.363733115678147,0.422704697551708,2.24843945068664,2.27392523969427,"HSPB1"
"809","regulation of actin cytoskeleton organization (GO:0032956)","1/91",0.366928825262423,0.424841142936394,2.22334455667789,2.22909720803597,"RHOB"
"810","positive regulation of supramolecular fiber organization (GO:1902905)","1/91",0.366928825262423,0.424841142936394,2.22334455667789,2.22909720803597,"CLU"
"811","positive regulation of transport (GO:0051050)","1/91",0.366928825262423,0.424841142936394,2.22334455667789,2.22909720803597,"SGK1"
"812","regulation of peptidyl-tyrosine phosphorylation (GO:0050730)","1/92",0.370108643786799,0.426943509233175,2.1988011988012,2.18551754723327,"CD81"
"813","positive regulation of cellular component biogenesis (GO:0044089)","1/92",0.370108643786799,0.426943509233175,2.1988011988012,2.18551754723327,"CLU"
"814","Wnt signaling pathway (GO:0016055)","1/92",0.370108643786799,0.426943509233175,2.1988011988012,2.18551754723327,"FZD6"
"815","regulation of heart contraction (GO:0008016)","1/93",0.373272649434986,0.430065052539204,2.1747913921827,2.14313983216348,"ATP1B3"
"816","regulation of intracellular signal transduction (GO:1902531)","3/437",0.373912798778029,0.430274654476188,1.38719179058388,1.36462587993135,"HSPB1;SGK1;RHOB"
"817","negative regulation of MAPK cascade (GO:0043409)","1/94",0.376420920115876,0.432101765267491,2.15129792549147,2.10191981526176,"TIMP3"
"818","positive regulation of epithelial cell migration (GO:0010634)","1/94",0.376420920115876,0.432101765267491,2.15129792549147,2.10191981526176,"RHOB"
"819","ciliary basal body-plasma membrane docking (GO:0097711)","1/95",0.379553533216983,0.434635082549691,2.12830431979368,2.06181530451832,"TUBA4A"
"820","mRNA metabolic process (GO:0016071)","1/95",0.379553533216983,0.434635082549691,2.12830431979368,2.06181530451832,"HSPA1A"
"821","cellular transition metal ion homeostasis (GO:0046916)","1/96",0.382670565880735,0.437670720294775,2.10579479000532,2.02278604662789,"FTL"
"822","positive regulation of defense response (GO:0031349)","1/98",0.388858196397513,0.444206625811758,2.06216807247735,1.94780133547852,"S100A8"
"823","organic anion transport (GO:0015711)","1/99",0.391928946523868,0.446627767944069,2.0410224695939,1.91177413897195,"CA12"
"824","sensory perception of chemical stimulus (GO:0007606)","1/99",0.391928946523868,0.446627767944069,2.0410224695939,1.91177413897195,"CD36"
"825","cell-matrix adhesion (GO:0007160)","1/100",0.394984420817951,0.448476869586525,2.02030405060708,1.87667852610055,"LYPD3"
"826","organic acid transport (GO:0015849)","1/100",0.394984420817951,0.448476869586525,2.02030405060708,1.87667852610055,"SLC7A8"
"827","regulation of transforming growth factor beta receptor signaling pathway (GO:0017015)","1/100",0.394984420817951,0.448476869586525,2.02030405060708,1.87667852610055,"HSPA1A"
"828","positive regulation of protein localization to membrane (GO:1905477)","1/101",0.398024694482133,0.451383077438072,2,1.84248245836996,"CD81"
"829","calcium-mediated signaling (GO:0019722)","1/102",0.401049842395342,0.453717833746056,1.98009800980098,1.80915528558786,"ACKR3"
"830","positive regulation of cell growth (GO:0030307)","1/102",0.401049842395342,0.453717833746056,1.98009800980098,1.80915528558786,"S100A8"
"831","protein targeting to ER (GO:0045047)","1/103",0.404059939073185,0.45602437835303,1.9605862547039,1.77666767339805,"ZFAND2A"
"832","chromatin remodeling (GO:0006338)","1/103",0.404059939073185,0.45602437835303,1.9605862547039,1.77666767339805,"KDM5B"
"833","cellular metal ion homeostasis (GO:0006875)","1/104",0.407055058636552,0.458853181344204,1.94145336863783,1.74499153520703,"ATP1B3"
"834","small GTPase mediated signal transduction (GO:0007264)","1/106",0.413000661133786,0.464440264436676,1.9042809042809,1.68396719161278,"JUN"
"835","protein localization to nucleus (GO:0034504)","1/106",0.413000661133786,0.464440264436676,1.9042809042809,1.68396719161278,"MMP12"
"836","negative regulation of transmembrane receptor protein serine/threonine kinase signaling pathway (GO:0090101)","1/108",0.41888723576301,0.470496548303189,1.86849806475975,1.62588017253325,"HSPA1A"
"837","regulation of protein ubiquitination (GO:0031396)","1/109",0.421808569139365,0.473211763944879,1.85110362888141,1.59787949320038,"HSPA1A"
"838","regulation of protein kinase activity (GO:0045859)","1/110",0.424715362613925,0.475336979135251,1.83402835696414,1.57054463447437,"HSPB1"
"839","response to endoplasmic reticulum stress (GO:0034976)","1/110",0.424715362613925,0.475336979135251,1.83402835696414,1.57054463447437,"JUN"
"840","regulation of Wnt signaling pathway (GO:0030111)","1/111",0.427607687964041,0.478004308331231,1.81726354453627,1.54385464626272,"RSPO3"
"841","sulfur compound biosynthetic process (GO:0044272)","1/113",0.433349218837219,0.483846511876514,1.78463203463203,1.4923295915181,"GSTA4"
"842","cellular response to cytokine stimulus (GO:0071345)","3/482",0.434456884498751,0.484507143164284,1.25396552095216,1.04537910221471,"SOX2;CD36;FOS"
"843","positive regulation of cellular component organization (GO:0051130)","1/114",0.436198565833718,0.485872423864604,1.76874944131581,1.46745661650072,"CLU"
"844","cellular amide metabolic process (GO:0043603)","1/115",0.439033727758999,0.487872982681302,1.7531454899876,1.44315262186649,"DBI"
"845","positive regulation of protein metabolic process (GO:0051247)","1/115",0.439033727758999,0.487872982681302,1.7531454899876,1.44315262186649,"CLU"
"846","extracellular matrix organization (GO:0030198)","2/300",0.443847898592507,0.492639688863315,1.34241884673332,1.09041104834037,"MMP12;SPINK5"
"847","innate immune response (GO:0045087)","2/302",0.447225916410521,0.495281840725893,1.33333333333333,1.07292187493732,"KRT1;WFDC2"
"848","regulation of cellular response to stress (GO:0080135)","1/118",0.447454800068397,0.495281840725893,1.70793404126737,1.37348597340122,"HSPA1A"
"849","negative regulation of transcription by RNA polymerase II (GO:0000122)","4/684",0.447810737780919,0.495281840725893,1.17769607843137,0.946142888345187,"SOX2;JUN;FOSB;HSPA1A"
"850","protein phosphorylation (GO:0006468)","3/496",0.452892608208507,0.500313128362104,1.21747767717112,0.964364371941117,"MAPK10;EPHA4;SGK1"
"851","cellular response to interferon-gamma (GO:0071346)","1/121",0.455750702577925,0.502878859836277,1.66498316498317,1.30835929507761,"HLA-DRA"
"852","potassium ion transport (GO:0006813)","1/122",0.458488507016457,0.505305995408982,1.6511394941147,1.28759168960267,"ATP1B3"
"853","positive regulation of epithelial cell proliferation (GO:0050679)","1/123",0.461212676190375,0.507712430179088,1.63752276867031,1.26727232996582,"MMP12"
"854","non-canonical Wnt signaling pathway (GO:0035567)","1/124",0.463923277206856,0.509501704441214,1.62412745339575,1.2473885010387,"FZD6"
"855","fatty acid metabolic process (GO:0006631)","1/124",0.463923277206856,0.509501704441214,1.62412745339575,1.2473885010387,"CD36"
"856","protein targeting (GO:0006605)","1/125",0.46662037707619,0.511267834392699,1.61094819159335,1.22792793965158,"ZFAND2A"
"857","regulation of phosphorylation (GO:0042325)","1/125",0.46662037707619,0.511267834392699,1.61094819159335,1.22792793965158,"HSPB1"
"858","negative regulation of cell growth (GO:0030308)","1/126",0.469304042324134,0.513011054414857,1.5979797979798,1.20887881651748,"HSPA1A"
"859","negative regulation of growth (GO:0045926)","1/126",0.469304042324134,0.513011054414857,1.5979797979798,1.20887881651748,"HSPA1A"
"860","positive regulation of transcription by RNA polymerase II (GO:0045944)","5/908",0.478075286158669,0.521991504305803,1.10724485632686,0.817132372310982,"SOX2;MMP12;JUN;CD81;FOS"
